{
  "$id": "https://graft.invalid/schema/eval-case.v1.json",
  "title": "Graft eval case v1",
  "description": "Generated from src/eval/case-schema.ts (pnpm eval schema --write). Rules a JSON Schema cannot express: id equals the file name without the extension; synthetic ids start with syn-; pilot ids start with <setId>--; tags are unique; pilot fakeLlm is null; pilot inputs.repositoryFullName equals source.repository and inputs.pr.number equals source.prNumber; labels have unique labelers; every outOfScope list is sorted, unique and made of paths in inputs.files.",
  "$schema": "https://json-schema.org/draft/2020-12/schema",
  "type": "object",
  "properties": {
    "schemaVersion": {
      "type": "number",
      "const": 1
    },
    "id": {
      "type": "string",
      "pattern": "^[a-z0-9][a-z0-9._-]{0,99}$"
    },
    "source": {
      "oneOf": [
        {
          "type": "object",
          "properties": {
            "kind": {
              "type": "string",
              "const": "synthetic"
            },
            "author": {
              "type": "string",
              "minLength": 1,
              "maxLength": 100
            },
            "createdAt": {
              "type": "string",
              "pattern": "^\\d{4}-\\d{2}-\\d{2}$"
            }
          },
          "required": [
            "kind",
            "author",
            "createdAt"
          ],
          "additionalProperties": false
        },
        {
          "type": "object",
          "properties": {
            "kind": {
              "type": "string",
              "const": "pilot"
            },
            "setId": {
              "type": "string",
              "pattern": "^[a-z0-9][a-z0-9-]{0,39}$"
            },
            "repository": {
              "type": "string",
              "pattern": "^[A-Za-z0-9_.-]{1,100}\\/[A-Za-z0-9_.-]{1,100}$"
            },
            "prNumber": {
              "type": "integer",
              "exclusiveMinimum": 0,
              "maximum": 9007199254740991
            },
            "headSha": {
              "type": "string",
              "pattern": "^[0-9a-f]{40}$"
            },
            "baseSha": {
              "type": "string",
              "pattern": "^[0-9a-f]{40}$"
            },
            "mergedAt": {
              "type": "string",
              "pattern": "^\\d{4}-\\d{2}-\\d{2}T\\d{2}:\\d{2}:\\d{2}(\\.\\d+)?(Z|[+-]\\d{2}:\\d{2})$"
            },
            "exportedAt": {
              "type": "string",
              "pattern": "^\\d{4}-\\d{2}-\\d{2}T\\d{2}:\\d{2}:\\d{2}(\\.\\d+)?(Z|[+-]\\d{2}:\\d{2})$"
            },
            "exportTool": {
              "type": "string",
              "const": "graft-eval-export/1"
            },
            "authorKind": {
              "type": "string",
              "enum": [
                "agent",
                "human"
              ]
            },
            "authorKindReason": {
              "type": "string",
              "enum": [
                "trailer",
                "bot_account",
                "configured_login",
                "agent_coauthor",
                "none"
              ]
            },
            "agent": {
              "type": [
                "string",
                "null"
              ]
            },
            "model": {
              "type": [
                "string",
                "null"
              ]
            },
            "redactions": {
              "type": "array",
              "items": {
                "type": "object",
                "properties": {
                  "kind": {
                    "type": "string"
                  },
                  "count": {
                    "type": "integer",
                    "minimum": 0,
                    "maximum": 9007199254740991
                  }
                },
                "required": [
                  "kind",
                  "count"
                ],
                "additionalProperties": false
              }
            }
          },
          "required": [
            "kind",
            "setId",
            "repository",
            "prNumber",
            "headSha",
            "baseSha",
            "mergedAt",
            "exportedAt",
            "exportTool",
            "authorKind",
            "authorKindReason",
            "agent",
            "model",
            "redactions"
          ],
          "additionalProperties": false
        }
      ]
    },
    "tags": {
      "maxItems": 20,
      "type": "array",
      "items": {
        "type": "string",
        "pattern": "^[a-z0-9-]{1,40}$"
      }
    },
    "floorConfig": {
      "type": "object",
      "properties": {
        "extraSensitiveGlobs": {
          "maxItems": 100,
          "type": "array",
          "items": {
            "type": "string",
            "minLength": 1,
            "maxLength": 200
          }
        }
      },
      "required": [
        "extraSensitiveGlobs"
      ],
      "additionalProperties": false
    },
    "inputs": {
      "type": "object",
      "properties": {
        "repositoryFullName": {
          "type": "string",
          "pattern": "^[A-Za-z0-9_.-]{1,100}\\/[A-Za-z0-9_.-]{1,100}$"
        },
        "pr": {
          "type": "object",
          "properties": {
            "number": {
              "type": "integer",
              "exclusiveMinimum": 0,
              "maximum": 9007199254740991
            },
            "title": {
              "type": "string"
            },
            "body": {
              "type": "string"
            },
            "additions": {
              "type": "integer",
              "minimum": 0,
              "maximum": 9007199254740991
            },
            "deletions": {
              "type": "integer",
              "minimum": 0,
              "maximum": 9007199254740991
            },
            "changedFiles": {
              "type": "integer",
              "minimum": 0,
              "maximum": 9007199254740991
            }
          },
          "required": [
            "number",
            "title",
            "body",
            "additions",
            "deletions",
            "changedFiles"
          ],
          "additionalProperties": false
        },
        "issue": {
          "anyOf": [
            {
              "type": "object",
              "properties": {
                "number": {
                  "type": "integer",
                  "exclusiveMinimum": 0,
                  "maximum": 9007199254740991
                },
                "title": {
                  "type": "string"
                },
                "body": {
                  "type": "string"
                }
              },
              "required": [
                "number",
                "title",
                "body"
              ],
              "additionalProperties": false
            },
            {
              "type": "null"
            }
          ]
        },
        "files": {
          "type": "array",
          "items": {
            "type": "object",
            "properties": {
              "path": {
                "type": "string",
                "minLength": 1
              },
              "previousPath": {
                "type": [
                  "string",
                  "null"
                ]
              },
              "status": {
                "type": "string",
                "enum": [
                  "added",
                  "removed",
                  "modified",
                  "renamed",
                  "copied",
                  "changed",
                  "unchanged"
                ]
              },
              "additions": {
                "type": "integer",
                "minimum": 0,
                "maximum": 9007199254740991
              },
              "deletions": {
                "type": "integer",
                "minimum": 0,
                "maximum": 9007199254740991
              },
              "patch": {
                "type": [
                  "string",
                  "null"
                ]
              },
              "headText": {
                "type": [
                  "string",
                  "null"
                ]
              }
            },
            "required": [
              "path",
              "previousPath",
              "status",
              "additions",
              "deletions",
              "patch"
            ],
            "additionalProperties": false
          }
        },
        "listingTruncated": {
          "type": "boolean"
        },
        "tooLarge": {
          "type": "boolean"
        }
      },
      "required": [
        "repositoryFullName",
        "pr",
        "issue",
        "files",
        "listingTruncated",
        "tooLarge"
      ],
      "additionalProperties": false
    },
    "labels": {
      "maxItems": 5,
      "type": "array",
      "items": {
        "type": "object",
        "properties": {
          "labeler": {
            "type": "string",
            "pattern": "^[a-z0-9][a-z0-9._-]{0,39}$"
          },
          "labeledAt": {
            "type": "string",
            "pattern": "^\\d{4}-\\d{2}-\\d{2}T\\d{2}:\\d{2}:\\d{2}(\\.\\d+)?(Z|[+-]\\d{2}:\\d{2})$"
          },
          "guideVersion": {
            "type": "string",
            "pattern": "^lg-\\d+$"
          },
          "risk": {
            "type": "string",
            "enum": [
              "trivial",
              "logic",
              "sensitive"
            ]
          },
          "outOfScope": {
            "type": "array",
            "items": {
              "type": "string"
            }
          },
          "goal": {
            "type": "string",
            "maxLength": 300
          },
          "keyBehaviorChanges": {
            "maxItems": 10,
            "type": "array",
            "items": {
              "type": "string",
              "maxLength": 300
            }
          },
          "shouldFlag": {
            "type": "boolean"
          },
          "confidence": {
            "type": "string",
            "enum": [
              "high",
              "medium",
              "low"
            ]
          },
          "notes": {
            "type": "string",
            "maxLength": 2000
          }
        },
        "required": [
          "labeler",
          "labeledAt",
          "guideVersion",
          "risk",
          "outOfScope",
          "goal",
          "keyBehaviorChanges",
          "shouldFlag",
          "confidence",
          "notes"
        ],
        "additionalProperties": false
      }
    },
    "adjudicated": {
      "anyOf": [
        {
          "type": "object",
          "properties": {
            "labeler": {
              "type": "string",
              "pattern": "^[a-z0-9][a-z0-9._-]{0,39}$"
            },
            "labeledAt": {
              "type": "string",
              "pattern": "^\\d{4}-\\d{2}-\\d{2}T\\d{2}:\\d{2}:\\d{2}(\\.\\d+)?(Z|[+-]\\d{2}:\\d{2})$"
            },
            "guideVersion": {
              "type": "string",
              "pattern": "^lg-\\d+$"
            },
            "risk": {
              "type": "string",
              "enum": [
                "trivial",
                "logic",
                "sensitive"
              ]
            },
            "outOfScope": {
              "type": "array",
              "items": {
                "type": "string"
              }
            },
            "goal": {
              "type": "string",
              "maxLength": 300
            },
            "keyBehaviorChanges": {
              "maxItems": 10,
              "type": "array",
              "items": {
                "type": "string",
                "maxLength": 300
              }
            },
            "shouldFlag": {
              "type": "boolean"
            },
            "confidence": {
              "type": "string",
              "enum": [
                "high",
                "medium",
                "low"
              ]
            },
            "notes": {
              "type": "string",
              "maxLength": 2000
            }
          },
          "required": [
            "labeler",
            "labeledAt",
            "guideVersion",
            "risk",
            "outOfScope",
            "goal",
            "keyBehaviorChanges",
            "shouldFlag",
            "confidence",
            "notes"
          ],
          "additionalProperties": false
        },
        {
          "type": "null"
        }
      ]
    },
    "fakeLlm": {
      "anyOf": [
        {
          "type": "object",
          "properties": {
            "writer": {
              "anyOf": [
                {
                  "type": "object",
                  "properties": {
                    "json": {}
                  },
                  "required": [
                    "json"
                  ],
                  "additionalProperties": false
                },
                {
                  "type": "object",
                  "properties": {
                    "failure": {
                      "type": "string",
                      "enum": [
                        "timeout",
                        "rate_limited",
                        "unavailable",
                        "auth",
                        "bad_request",
                        "refusal",
                        "max_tokens",
                        "invalid_json",
                        "not_configured"
                      ]
                    }
                  },
                  "required": [
                    "failure"
                  ],
                  "additionalProperties": false
                }
              ]
            },
            "writerEscalated": {
              "anyOf": [
                {
                  "type": "object",
                  "properties": {
                    "json": {}
                  },
                  "required": [
                    "json"
                  ],
                  "additionalProperties": false
                },
                {
                  "type": "object",
                  "properties": {
                    "failure": {
                      "type": "string",
                      "enum": [
                        "timeout",
                        "rate_limited",
                        "unavailable",
                        "auth",
                        "bad_request",
                        "refusal",
                        "max_tokens",
                        "invalid_json",
                        "not_configured"
                      ]
                    }
                  },
                  "required": [
                    "failure"
                  ],
                  "additionalProperties": false
                }
              ]
            },
            "verifier": {
              "anyOf": [
                {
                  "anyOf": [
                    {
                      "type": "object",
                      "properties": {
                        "json": {}
                      },
                      "required": [
                        "json"
                      ],
                      "additionalProperties": false
                    },
                    {
                      "type": "object",
                      "properties": {
                        "failure": {
                          "type": "string",
                          "enum": [
                            "timeout",
                            "rate_limited",
                            "unavailable",
                            "auth",
                            "bad_request",
                            "refusal",
                            "max_tokens",
                            "invalid_json",
                            "not_configured"
                          ]
                        }
                      },
                      "required": [
                        "failure"
                      ],
                      "additionalProperties": false
                    }
                  ]
                },
                {
                  "type": "string",
                  "const": "agree"
                }
              ]
            }
          },
          "additionalProperties": false
        },
        {
          "type": "null"
        }
      ]
    }
  },
  "required": [
    "schemaVersion",
    "id",
    "source",
    "tags",
    "floorConfig",
    "inputs",
    "labels",
    "adjudicated",
    "fakeLlm"
  ],
  "additionalProperties": false
}
