{
  "schemaVersion": 1,
  "id": "syn-029-pure-rename",
  "source": {
    "kind": "synthetic",
    "author": "graft-team",
    "createdAt": "2026-10-15"
  },
  "tags": [
    "rename",
    "known-over-classification"
  ],
  "floorConfig": {
    "extraSensitiveGlobs": []
  },
  "inputs": {
    "repositoryFullName": "fictional-org/shop-demo",
    "pr": {
      "number": 129,
      "title": "Rename docs/a.md to docs/b.md",
      "body": "Naming.",
      "additions": 0,
      "deletions": 0,
      "changedFiles": 1
    },
    "issue": null,
    "files": [
      {
        "path": "docs/b.md",
        "previousPath": "docs/a.md",
        "status": "renamed",
        "additions": 0,
        "deletions": 0,
        "patch": null
      }
    ],
    "listingTruncated": false,
    "tooLarge": false
  },
  "labels": [
    {
      "labeler": "graft-synthetic",
      "labeledAt": "2026-10-15T00:00:00Z",
      "guideVersion": "lg-1",
      "risk": "trivial",
      "outOfScope": [],
      "goal": "Renames a documentation file.",
      "keyBehaviorChanges": [
        "The file has a new name."
      ],
      "shouldFlag": false,
      "confidence": "high",
      "notes": "No content change."
    }
  ],
  "adjudicated": null,
  "fakeLlm": {
    "writer": {
      "json": {
        "goal": "Rename a documentation file.",
        "behavior_changes": [
          "No observable behavior change."
        ],
        "risk_class": "trivial",
        "risk_reason": "A rename.",
        "out_of_scope_edits": [],
        "instructions_in_data": false
      }
    },
    "verifier": "agree"
  }
}
