{
  "schemaVersion": 1,
  "id": "syn-007-lockfile-bump",
  "source": {
    "kind": "synthetic",
    "author": "graft-team",
    "createdAt": "2026-10-15"
  },
  "tags": [
    "floor",
    "dependency"
  ],
  "floorConfig": {
    "extraSensitiveGlobs": []
  },
  "inputs": {
    "repositoryFullName": "fictional-org/shop-demo",
    "pr": {
      "number": 107,
      "title": "Update lockfile",
      "body": "Routine lockfile refresh.",
      "additions": 1,
      "deletions": 1,
      "changedFiles": 1
    },
    "issue": null,
    "files": [
      {
        "path": "pnpm-lock.yaml",
        "previousPath": null,
        "status": "modified",
        "additions": 1,
        "deletions": 1,
        "patch": "@@ -10,2 +10,2 @@\n-  left-pad@1.3.0:\n+  left-pad@1.3.1:\n packages:"
      }
    ],
    "listingTruncated": false,
    "tooLarge": false
  },
  "labels": [
    {
      "labeler": "graft-synthetic",
      "labeledAt": "2026-10-15T00:00:00Z",
      "guideVersion": "lg-1",
      "risk": "sensitive",
      "outOfScope": [],
      "goal": "Refreshes locked dependency versions.",
      "keyBehaviorChanges": [
        "A locked dependency version changes."
      ],
      "shouldFlag": false,
      "confidence": "high",
      "notes": ""
    }
  ],
  "adjudicated": null,
  "fakeLlm": {
    "writer": {
      "json": {
        "goal": "Refresh the lockfile.",
        "behavior_changes": [
          "No observable behavior change."
        ],
        "risk_class": "trivial",
        "risk_reason": "Lockfile only.",
        "out_of_scope_edits": [],
        "instructions_in_data": false
      }
    },
    "verifier": "agree"
  }
}
